"No.","Time","Source","Destination","Protocol","Length","Info"
"1","0.000000000","10.0.0.1","10.1.0.2","TCP","82","36011  >  9999 [SYN] Seq=0 Win=65535 Len=0"
"2","0.000692369","10.1.0.2","10.0.0.1","TCP","82","9999  >  36011 [SYN, ACK] Seq=0 Ack=1 Win=65535 Len=0"
"3","0.000905792","10.0.0.1","10.1.0.2","TCP","82","36011  >  9999 [ACK] Seq=1 Ack=1 Win=65535 Len=0"
"4","0.001564455","10.0.0.1","10.1.0.2","TCP","1442","36011  >  9999 [ACK] Seq=1 Ack=1 Win=65535 Len=1360 [TCP segment of a reassembled PDU]"
"5","0.001581669","10.0.0.1","10.1.0.2","TCP","1442","36011  >  9999 [ACK] Seq=1361 Ack=1 Win=65535 Len=1360 [TCP segment of a reassembled PDU]"
"6","0.001587169","10.0.0.1","10.1.0.2","TCP","1442","36011  >  9999 [ACK] Seq=2721 Ack=1 Win=65535 Len=1360 [TCP segment of a reassembled PDU]"
"7","0.001592169","10.0.0.1","10.1.0.2","TCP","1442","36011  >  9999 [ACK] Seq=4081 Ack=1 Win=65535 Len=1360 [TCP segment of a reassembled PDU]"
"8","0.001596628","10.0.0.1","10.1.0.2","TCP","1442","36011  >  9999 [ACK] Seq=5441 Ack=1 Win=65535 Len=1360 [TCP segment of a reassembled PDU]"
"9","0.001601737","10.0.0.1","10.1.0.2","TCP","1442","36011  >  9999 [ACK] Seq=6801 Ack=1 Win=65535 Len=1360 [TCP segment of a reassembled PDU]"
"10","0.001608020","10.0.0.1","10.1.0.2","TCP","1442","36011  >  9999 [ACK] Seq=8161 Ack=1 Win=65535 Len=1360 [TCP segment of a reassembled PDU]"
"11","0.001670441","10.0.0.1","10.1.0.2","TCP","1442","36011  >  9999 [ACK] Seq=9521 Ack=1 Win=65535 Len=1360 [TCP segment of a reassembled PDU]"
"12","0.001678747","10.0.0.1","10.1.0.2","TCP","1442","36011  >  9999 [ACK] Seq=10881 Ack=1 Win=65535 Len=1360 [TCP segment of a reassembled PDU]"
"13","0.001684188","10.0.0.1","10.1.0.2","TCP","1442","36011  >  9999 [ACK] Seq=12241 Ack=1 Win=65535 Len=1360 [TCP segment of a reassembled PDU]"
"14","0.001689358","10.0.0.1","10.1.0.2","TCP","1442","36011  >  9999 [ACK] Seq=13601 Ack=1 Win=65535 Len=1360 [TCP segment of a reassembled PDU]"
"15","0.001694398","10.0.0.1","10.1.0.2","TCP","1442","36011  >  9999 [ACK] Seq=14961 Ack=1 Win=65535 Len=1360 [TCP segment of a reassembled PDU]"
"16","0.001698886","10.0.0.1","10.1.0.2","TCP","1442","36011  >  9999 [ACK] Seq=16321 Ack=1 Win=65535 Len=1360 [TCP segment of a reassembled PDU]"
"17","0.001704076","10.0.0.1","10.1.0.2","TCP","1442","36011  >  9999 [ACK] Seq=17681 Ack=1 Win=65535 Len=1360 [TCP segment of a reassembled PDU]"
"18","0.001783862","10.0.0.1","10.1.0.2","TCP","1442","36011  >  9999 [ACK] Seq=19041 Ack=1 Win=65535 Len=1360 [TCP segment of a reassembled PDU]"
"19","0.001823308","10.0.0.1","10.1.0.2","TCP","1442","36011  >  9999 [ACK] Seq=20401 Ack=1 Win=65535 Len=1360 [TCP segment of a reassembled PDU]"
"20","0.001832937","10.0.0.1","10.1.0.2","TCP","1442","36011  >  9999 [ACK] Seq=21761 Ack=1 Win=65535 Len=1360 [TCP segment of a reassembled PDU]"
"21","0.001842826","10.0.0.1","10.1.0.2","TCP","1442","36011  >  9999 [ACK] Seq=23121 Ack=1 Win=65535 Len=1360 [TCP segment of a reassembled PDU]"
"22","0.001853066","10.0.0.1","10.1.0.2","TCP","1442","36011  >  9999 [ACK] Seq=24481 Ack=1 Win=65535 Len=1360 [TCP segment of a reassembled PDU]"
"23","0.001860420","10.0.0.1","10.1.0.2","TCP","1442","36011  >  9999 [ACK] Seq=25841 Ack=1 Win=65535 Len=1360 [TCP segment of a reassembled PDU]"
"24","0.001870760","10.0.0.1","10.1.0.2","TCP","1442","36011  >  9999 [ACK] Seq=27201 Ack=1 Win=65535 Len=1360 [TCP segment of a reassembled PDU]"
"25","0.001877332","10.0.0.1","10.1.0.2","TCP","1442","36011  >  9999 [ACK] Seq=28561 Ack=1 Win=65535 Len=1360 [TCP segment of a reassembled PDU]"
"26","0.001882322","10.0.0.1","10.1.0.2","TCP","1442","36011  >  9999 [ACK] Seq=29921 Ack=1 Win=65535 Len=1360 [TCP segment of a reassembled PDU]"
"27","0.001887041","10.0.0.1","10.1.0.2","TCP","1442","36011  >  9999 [ACK] Seq=31281 Ack=1 Win=65535 Len=1360 [TCP segment of a reassembled PDU]"
"28","0.001893474","10.0.0.1","10.1.0.2","TCP","1442","36011  >  9999 [ACK] Seq=32641 Ack=1 Win=65535 Len=1360 [TCP segment of a reassembled PDU]"
"29","0.001903263","10.0.0.1","10.1.0.2","TCP","1442","36011  >  9999 [ACK] Seq=34001 Ack=1 Win=65535 Len=1360 [TCP segment of a reassembled PDU]"
"30","0.001924113","10.0.0.1","10.1.0.2","TCP","1442","36011  >  9999 [ACK] Seq=35361 Ack=1 Win=65535 Len=1360 [TCP segment of a reassembled PDU]"
"31","0.001962317","10.0.0.1","10.1.0.2","TCP","1442","36011  >  9999 [ACK] Seq=36721 Ack=1 Win=65535 Len=1360 [TCP segment of a reassembled PDU]"
"32","0.001973008","10.0.0.1","10.1.0.2","TCP","1442","36011  >  9999 [ACK] Seq=38081 Ack=1 Win=65535 Len=1360 [TCP segment of a reassembled PDU]"
"33","0.001980602","10.0.0.1","10.1.0.2","TCP","1442","36011  >  9999 [ACK] Seq=39441 Ack=1 Win=65535 Len=1360 [TCP segment of a reassembled PDU]"
"34","0.001987826","10.0.0.1","10.1.0.2","TCP","1442","36011  >  9999 [ACK] Seq=40801 Ack=1 Win=65535 Len=1360 [TCP segment of a reassembled PDU]"
"35","0.001994329","10.0.0.1","10.1.0.2","TCP","1442","36011  >  9999 [ACK] Seq=42161 Ack=1 Win=65535 Len=1360 [TCP segment of a reassembled PDU]"
"36","0.001998938","10.0.0.1","10.1.0.2","TCP","1442","36011  >  9999 [ACK] Seq=43521 Ack=1 Win=65535 Len=1360 [TCP segment of a reassembled PDU]"
"37","0.001999919","10.1.0.2","10.0.0.1","TCP","82","9999  >  36011 [ACK] Seq=1 Ack=5441 Win=60095 Len=0"
"38","0.002009958","10.1.0.2","10.0.0.1","TCP","82","9999  >  36011 [ACK] Seq=1 Ack=6801 Win=58735 Len=0"
"39","0.002032291","10.1.0.2","10.0.0.1","TCP","82","9999  >  36011 [ACK] Seq=1 Ack=8161 Win=57375 Len=0"
"40","0.002078861","10.0.0.1","10.1.0.2","TCP","1442","36011  >  9999 [ACK] Seq=44881 Ack=1 Win=65535 Len=1360 [TCP segment of a reassembled PDU]"
"41","0.002097908","10.0.0.1","10.1.0.2","TCP","1442","36011  >  9999 [ACK] Seq=46241 Ack=1 Win=65535 Len=1360 [TCP segment of a reassembled PDU]"
"42","0.002107286","10.1.0.2","10.0.0.1","TCP","82","9999  >  36011 [ACK] Seq=1 Ack=9521 Win=56015 Len=0"
"43","0.002111935","10.0.0.1","10.1.0.2","TCP","1442","36011  >  9999 [ACK] Seq=47601 Ack=1 Win=65535 Len=1360 [TCP segment of a reassembled PDU]"
"44","0.002117566","10.0.0.1","10.1.0.2","TCP","1442","36011  >  9999 [ACK] Seq=48961 Ack=1 Win=65535 Len=1360 [TCP segment of a reassembled PDU]"
"45","0.002123077","10.0.0.1","10.1.0.2","TCP","1442","36011  >  9999 [ACK] Seq=50321 Ack=1 Win=65535 Len=1360 [TCP segment of a reassembled PDU]"
"46","0.002127876","10.0.0.1","10.1.0.2","TCP","1442","36011  >  9999 [ACK] Seq=51681 Ack=1 Win=65535 Len=1360 [TCP segment of a reassembled PDU]"
"47","0.002149278","10.0.0.1","10.1.0.2","TCP","1442","36011  >  9999 [ACK] Seq=53041 Ack=1 Win=65535 Len=1360 [TCP segment of a reassembled PDU]"
"48","0.002155890","10.0.0.1","10.1.0.2","TCP","1442","36011  >  9999 [ACK] Seq=54401 Ack=1 Win=65535 Len=1360 [TCP segment of a reassembled PDU]"
"49","0.002160419","10.0.0.1","10.1.0.2","TCP","1442","36011  >  9999 [ACK] Seq=55761 Ack=1 Win=65535 Len=1360 [TCP segment of a reassembled PDU]"
"50","0.002160269","10.1.0.2","10.0.0.1","TCP","82","9999  >  36011 [ACK] Seq=1 Ack=10881 Win=54655 Len=0"
"51","0.002164808","10.0.0.1","10.1.0.2","TCP","1442","36011  >  9999 [ACK] Seq=57121 Ack=1 Win=65535 Len=1360 [TCP segment of a reassembled PDU]"
"52","0.002168124","10.1.0.2","10.0.0.1","TCP","82","9999  >  36011 [ACK] Seq=1 Ack=12241 Win=53295 Len=0"
"53","0.002169637","10.0.0.1","10.1.0.2","TCP","1442","36011  >  9999 [ACK] Seq=58481 Ack=1 Win=65535 Len=1360 [TCP segment of a reassembled PDU]"
"54","0.002174106","10.0.0.1","10.1.0.2","TCP","1442","36011  >  9999 [ACK] Seq=59841 Ack=1 Win=65535 Len=1360 [TCP segment of a reassembled PDU]"
"55","0.002175669","10.1.0.2","10.0.0.1","TCP","82","9999  >  36011 [ACK] Seq=1 Ack=13601 Win=51935 Len=0"
"56","0.002179075","10.0.0.1","10.1.0.2","TCP","1442","36011  >  9999 [ACK] Seq=61201 Ack=1 Win=65535 Len=1360 [TCP segment of a reassembled PDU]"
"57","0.002183814","10.0.0.1","10.1.0.2","TCP","1442","36011  >  9999 [ACK] Seq=62561 Ack=1 Win=65535 Len=1360 [TCP segment of a reassembled PDU]"
"58","0.002188343","10.0.0.1","10.1.0.2","TCP","1442","36011  >  9999 [ACK] Seq=63921 Ack=1 Win=65535 Len=1360 [TCP segment of a reassembled PDU]"
"59","0.002193894","10.0.0.1","10.1.0.2","TCP","337","[TCP Window Full] 36011  >  9999 [ACK] Seq=65281 Ack=1 Win=65535 Len=255 [TCP segment of a reassembled PDU]"
"60","0.002232539","10.1.0.2","10.0.0.1","TCP","82","9999  >  36011 [ACK] Seq=1 Ack=14961 Win=50575 Len=0"
"61","0.002295661","10.1.0.2","10.0.0.1","TCP","82","9999  >  36011 [ACK] Seq=1 Ack=16321 Win=49215 Len=0"
"62","0.002320649","10.1.0.2","10.0.0.1","TCP","82","9999  >  36011 [ACK] Seq=1 Ack=17681 Win=47855 Len=0"
"63","0.002330027","10.1.0.2","10.0.0.1","TCP","82","9999  >  36011 [ACK] Seq=1 Ack=19041 Win=46495 Len=0"
"64","0.002571544","10.1.0.2","10.0.0.1","TCP","82","9999  >  36011 [ACK] Seq=1 Ack=20401 Win=64175 Len=0"
"65","0.002589279","10.1.0.2","10.0.0.1","TCP","82","9999  >  36011 [ACK] Seq=1 Ack=21761 Win=62815 Len=0"
"66","0.002599328","10.1.0.2","10.0.0.1","TCP","82","[TCP Dup ACK 65#1] 9999  >  36011 [ACK] Seq=1 Ack=21761 Win=62815 Len=0"
"67","0.002621421","10.1.0.2","10.0.0.1","TCP","82","[TCP Dup ACK 65#2] 9999  >  36011 [ACK] Seq=1 Ack=21761 Win=62815 Len=0"
"68","0.002629787","10.1.0.2","10.0.0.1","TCP","82","[TCP Dup ACK 65#3] 9999  >  36011 [ACK] Seq=1 Ack=21761 Win=62815 Len=0"
"69","0.002634657","10.1.0.2","10.0.0.1","TCP","82","[TCP Dup ACK 65#4] 9999  >  36011 [ACK] Seq=1 Ack=21761 Win=62815 Len=0"
"70","0.002640348","10.1.0.2","10.0.0.1","TCP","82","[TCP Dup ACK 65#5] 9999  >  36011 [ACK] Seq=1 Ack=21761 Win=62815 Len=0"
"71","0.002648313","10.1.0.2","10.0.0.1","TCP","82","[TCP Window Update] 9999  >  36011 [ACK] Seq=1 Ack=21761 Win=65535 Len=0"
"72","0.002655807","10.1.0.2","10.0.0.1","TCP","82","[TCP Dup ACK 65#6] 9999  >  36011 [ACK] Seq=1 Ack=21761 Win=65535 Len=0"
"73","0.002662541","10.1.0.2","10.0.0.1","TCP","82","[TCP Dup ACK 65#7] 9999  >  36011 [ACK] Seq=1 Ack=21761 Win=65535 Len=0"
"74","0.002670426","10.1.0.2","10.0.0.1","TCP","82","[TCP Dup ACK 65#8] 9999  >  36011 [ACK] Seq=1 Ack=21761 Win=65535 Len=0"
"75","0.002677930","10.1.0.2","10.0.0.1","TCP","82","[TCP Dup ACK 65#9] 9999  >  36011 [ACK] Seq=1 Ack=21761 Win=65535 Len=0"
"76","0.002678191","10.0.0.1","10.1.0.2","TCP","1442","36011  >  9999 [ACK] Seq=65536 Ack=1 Win=65535 Len=1360 [TCP segment of a reassembled PDU]"
"77","0.002684743","10.1.0.2","10.0.0.1","TCP","82","[TCP Dup ACK 65#10] 9999  >  36011 [ACK] Seq=1 Ack=21761 Win=65535 Len=0"
"78","0.002688230","10.0.0.1","10.1.0.2","TCP","1442","36011  >  9999 [ACK] Seq=66896 Ack=1 Win=65535 Len=1360 [TCP segment of a reassembled PDU]"
"79","0.002692328","10.1.0.2","10.0.0.1","TCP","82","[TCP Dup ACK 65#11] 9999  >  36011 [ACK] Seq=1 Ack=21761 Win=65535 Len=0"
"80","0.002696206","10.0.0.1","10.1.0.2","TCP","1442","36011  >  9999 [ACK] Seq=68256 Ack=1 Win=65535 Len=1360 [TCP segment of a reassembled PDU]"
"81","0.002699262","10.1.0.2","10.0.0.1","TCP","82","[TCP Dup ACK 65#12] 9999  >  36011 [ACK] Seq=1 Ack=21761 Win=65535 Len=0"
"82","0.002702989","10.0.0.1","10.1.0.2","TCP","1442","36011  >  9999 [ACK] Seq=69616 Ack=1 Win=65535 Len=1360 [TCP segment of a reassembled PDU]"
"83","0.002704251","10.1.0.2","10.0.0.1","TCP","82","[TCP Dup ACK 65#13] 9999  >  36011 [ACK] Seq=1 Ack=21761 Win=65535 Len=0"
"84","0.002707848","10.0.0.1","10.1.0.2","TCP","1442","36011  >  9999 [ACK] Seq=70976 Ack=1 Win=65535 Len=1360 [TCP segment of a reassembled PDU]"
"85","0.002709131","10.1.0.2","10.0.0.1","TCP","82","[TCP Dup ACK 65#14] 9999  >  36011 [ACK] Seq=1 Ack=21761 Win=65535 Len=0"
"86","0.002712657","10.0.0.1","10.1.0.2","TCP","1442","36011  >  9999 [ACK] Seq=72336 Ack=1 Win=65535 Len=1360 [TCP segment of a reassembled PDU]"
"87","0.002713760","10.1.0.2","10.0.0.1","TCP","82","[TCP Dup ACK 65#15] 9999  >  36011 [ACK] Seq=1 Ack=21761 Win=65535 Len=0"
"88","0.002717216","10.0.0.1","10.1.0.2","TCP","1442","36011  >  9999 [ACK] Seq=73696 Ack=1 Win=65535 Len=1360 [TCP segment of a reassembled PDU]"
"89","0.002718429","10.1.0.2","10.0.0.1","TCP","82","[TCP Dup ACK 65#16] 9999  >  36011 [ACK] Seq=1 Ack=21761 Win=65535 Len=0"
"90","0.002722006","10.0.0.1","10.1.0.2","TCP","1442","36011  >  9999 [ACK] Seq=75056 Ack=1 Win=65535 Len=1360 [TCP segment of a reassembled PDU]"
"91","0.002723198","10.1.0.2","10.0.0.1","TCP","82","[TCP Dup ACK 65#17] 9999  >  36011 [ACK] Seq=1 Ack=21761 Win=65535 Len=0"
"92","0.002726745","10.0.0.1","10.1.0.2","TCP","1442","36011  >  9999 [ACK] Seq=76416 Ack=1 Win=65535 Len=1360 [TCP segment of a reassembled PDU]"
"93","0.002727807","10.1.0.2","10.0.0.1","TCP","82","[TCP Dup ACK 65#18] 9999  >  36011 [ACK] Seq=1 Ack=21761 Win=65535 Len=0"
"94","0.002731183","10.0.0.1","10.1.0.2","TCP","1442","36011  >  9999 [ACK] Seq=77776 Ack=1 Win=65535 Len=1360 [TCP segment of a reassembled PDU]"
"95","0.002735051","10.1.0.2","10.0.0.1","TCP","82","[TCP Dup ACK 65#19] 9999  >  36011 [ACK] Seq=1 Ack=21761 Win=65535 Len=0"
"96","0.002738347","10.0.0.1","10.1.0.2","TCP","1442","36011  >  9999 [ACK] Seq=79136 Ack=1 Win=65535 Len=1360 [TCP segment of a reassembled PDU]"
"97","0.002741784","10.1.0.2","10.0.0.1","TCP","82","[TCP Dup ACK 65#20] 9999  >  36011 [ACK] Seq=1 Ack=21761 Win=65535 Len=0"
"98","0.002742796","10.0.0.1","10.1.0.2","TCP","1442","36011  >  9999 [ACK] Seq=80496 Ack=1 Win=65535 Len=1360 [TCP segment of a reassembled PDU]"
"99","0.002747304","10.0.0.1","10.1.0.2","TCP","1442","36011  >  9999 [ACK] Seq=81856 Ack=1 Win=65535 Len=1360 [TCP segment of a reassembled PDU]"
"100","0.002751112","10.1.0.2","10.0.0.1","TCP","82","[TCP Dup ACK 65#21] 9999  >  36011 [ACK] Seq=1 Ack=21761 Win=65535 Len=0"
"101","0.002754388","10.0.0.1","10.1.0.2","TCP","1442","36011  >  9999 [ACK] Seq=83216 Ack=1 Win=65535 Len=1360 [TCP segment of a reassembled PDU]"
"102","0.002758977","10.1.0.2","10.0.0.1","TCP","82","[TCP Dup ACK 65#22] 9999  >  36011 [ACK] Seq=1 Ack=21761 Win=65535 Len=0"
"103","0.002767003","10.1.0.2","10.0.0.1","TCP","82","[TCP Dup ACK 65#23] 9999  >  36011 [ACK] Seq=1 Ack=21761 Win=65535 Len=0"
"104","0.002776832","10.1.0.2","10.0.0.1","TCP","82","[TCP Dup ACK 65#24] 9999  >  36011 [ACK] Seq=1 Ack=21761 Win=65535 Len=0"
"105","0.002782312","10.1.0.2","10.0.0.1","TCP","82","[TCP Dup ACK 65#25] 9999  >  36011 [ACK] Seq=1 Ack=21761 Win=65535 Len=0"
"106","0.002787272","10.1.0.2","10.0.0.1","TCP","82","[TCP Dup ACK 65#26] 9999  >  36011 [ACK] Seq=1 Ack=21761 Win=65535 Len=0"
"107","0.002827830","10.1.0.2","10.0.0.1","TCP","82","[TCP Dup ACK 65#27] 9999  >  36011 [ACK] Seq=1 Ack=21761 Win=65535 Len=0"
"108","0.002854001","10.1.0.2","10.0.0.1","TCP","82","[TCP Dup ACK 65#28] 9999  >  36011 [ACK] Seq=1 Ack=21761 Win=65535 Len=0"
"109","0.002886724","10.1.0.2","10.0.0.1","TCP","82","[TCP Dup ACK 65#29] 9999  >  36011 [ACK] Seq=1 Ack=21761 Win=65535 Len=0"
"110","0.002913847","10.1.0.2","10.0.0.1","TCP","82","[TCP Dup ACK 65#30] 9999  >  36011 [ACK] Seq=1 Ack=21761 Win=65535 Len=0"
"111","0.002929216","10.1.0.2","10.0.0.1","TCP","82","[TCP Dup ACK 65#31] 9999  >  36011 [ACK] Seq=1 Ack=21761 Win=65535 Len=0"
"112","0.003021555","10.1.0.2","10.0.0.1","TCP","82","[TCP Dup ACK 65#32] 9999  >  36011 [ACK] Seq=1 Ack=21761 Win=65535 Len=0"
"113","0.003037857","10.1.0.2","10.0.0.1","TCP","82","[TCP Dup ACK 65#33] 9999  >  36011 [ACK] Seq=1 Ack=21761 Win=65535 Len=0"
"114","0.003054930","10.1.0.2","10.0.0.1","TCP","82","[TCP Dup ACK 65#34] 9999  >  36011 [ACK] Seq=1 Ack=21761 Win=65535 Len=0"
"115","0.003061122","10.1.0.2","10.0.0.1","TCP","82","[TCP Dup ACK 65#35] 9999  >  36011 [ACK] Seq=1 Ack=21761 Win=65535 Len=0"
"116","0.003065881","10.1.0.2","10.0.0.1","TCP","82","[TCP Dup ACK 65#36] 9999  >  36011 [ACK] Seq=1 Ack=21761 Win=65535 Len=0"
"117","0.003071041","10.1.0.2","10.0.0.1","TCP","82","[TCP Dup ACK 65#37] 9999  >  36011 [ACK] Seq=1 Ack=21761 Win=65535 Len=0"
"118","0.003091540","10.1.0.2","10.0.0.1","TCP","82","[TCP Dup ACK 65#38] 9999  >  36011 [ACK] Seq=1 Ack=21761 Win=65535 Len=0"
"119","0.003104335","10.1.0.2","10.0.0.1","TCP","82","[TCP Dup ACK 65#39] 9999  >  36011 [ACK] Seq=1 Ack=21761 Win=65535 Len=0"
"120","0.003110697","10.1.0.2","10.0.0.1","TCP","82","[TCP Dup ACK 65#40] 9999  >  36011 [ACK] Seq=1 Ack=21761 Win=65535 Len=0"
"121","0.003115477","10.1.0.2","10.0.0.1","TCP","82","[TCP Dup ACK 65#41] 9999  >  36011 [ACK] Seq=1 Ack=21761 Win=65535 Len=0"
"122","0.003127750","10.1.0.2","10.0.0.1","TCP","82","[TCP Dup ACK 65#42] 9999  >  36011 [ACK] Seq=1 Ack=21761 Win=65535 Len=0"
"123","0.003133231","10.1.0.2","10.0.0.1","TCP","82","[TCP Dup ACK 65#43] 9999  >  36011 [ACK] Seq=1 Ack=21761 Win=65535 Len=0"
"124","0.003138601","10.1.0.2","10.0.0.1","TCP","82","[TCP Dup ACK 65#44] 9999  >  36011 [ACK] Seq=1 Ack=21761 Win=65535 Len=0"
"125","0.052543220","10.0.0.1","10.1.0.2","TCP","1442","[TCP Retransmission] 36011  >  9999 [ACK] Seq=21761 Ack=1 Win=65535 Len=1360"
"126","0.053113114","10.1.0.2","10.0.0.1","TCP","82","9999  >  36011 [ACK] Seq=1 Ack=83216 Win=4080 Len=0"
"127","0.053262130","10.0.0.1","10.1.0.2","TCP","1442","36011  >  9999 [ACK] Seq=84576 Ack=1 Win=65535 Len=1360 [TCP segment of a reassembled PDU]"
"128","0.053277009","10.0.0.1","10.1.0.2","TCP","1442","[TCP Window Full] 36011  >  9999 [ACK] Seq=85936 Ack=1 Win=65535 Len=1360 [TCP segment of a reassembled PDU]"
"129","0.053499271","10.1.0.2","10.0.0.1","TCP","82","[TCP Window Update] 9999  >  36011 [ACK] Seq=1 Ack=83216 Win=65535 Len=0"
"130","0.152667438","10.0.0.1","10.1.0.2","TCP","1442","[TCP Retransmission] 36011  >  9999 [ACK] Seq=83216 Ack=1 Win=65535 Len=1360"
"131","0.153540168","10.1.0.2","10.0.0.1","TCP","82","9999  >  36011 [ACK] Seq=1 Ack=85936 Win=62815 Len=0"
"132","0.153717922","10.0.0.1","10.1.0.2","TCP","1442","36011  >  9999 [ACK] Seq=87296 Ack=1 Win=65535 Len=1360 [TCP segment of a reassembled PDU]"
"133","0.153767338","10.0.0.1","10.1.0.2","TCP","1442","36011  >  9999 [ACK] Seq=88656 Ack=1 Win=65535 Len=1360 [TCP segment of a reassembled PDU]"
"134","0.153776646","10.0.0.1","10.1.0.2","TCP","1442","36011  >  9999 [ACK] Seq=90016 Ack=1 Win=65535 Len=1360 [TCP segment of a reassembled PDU]"
"135","0.153783950","10.0.0.1","10.1.0.2","TCP","1442","36011  >  9999 [ACK] Seq=91376 Ack=1 Win=65535 Len=1360 [TCP segment of a reassembled PDU]"
"136","0.153790593","10.0.0.1","10.1.0.2","TCP","1442","36011  >  9999 [ACK] Seq=92736 Ack=1 Win=65535 Len=1360 [TCP segment of a reassembled PDU]"
"137","0.153797386","10.0.0.1","10.1.0.2","TCP","1442","36011  >  9999 [ACK] Seq=94096 Ack=1 Win=65535 Len=1360 [TCP segment of a reassembled PDU]"
"138","0.153804300","10.0.0.1","10.1.0.2","TCP","1442","36011  >  9999 [ACK] Seq=95456 Ack=1 Win=65535 Len=1360 [TCP segment of a reassembled PDU]"
"139","0.154055887","10.0.0.1","10.1.0.2","TCP","1442","36011  >  9999 [ACK] Seq=96816 Ack=1 Win=65535 Len=1360 [TCP segment of a reassembled PDU]"
"140","0.154125121","10.0.0.1","10.1.0.2","TCP","1442","36011  >  9999 [ACK] Seq=98176 Ack=1 Win=65535 Len=1360 [TCP segment of a reassembled PDU]"
"141","0.154140019","10.0.0.1","10.1.0.2","TCP","1442","36011  >  9999 [ACK] Seq=99536 Ack=1 Win=65535 Len=1360 [TCP segment of a reassembled PDU]"
"142","0.154154337","10.0.0.1","10.1.0.2","TCP","1442","36011  >  9999 [ACK] Seq=100896 Ack=1 Win=65535 Len=1360 [TCP segment of a reassembled PDU]"
"143","0.154165409","10.0.0.1","10.1.0.2","TCP","1442","36011  >  9999 [ACK] Seq=102256 Ack=1 Win=65535 Len=1360 [TCP segment of a reassembled PDU]"
"144","0.154195507","10.0.0.1","10.1.0.2","TCP","1442","36011  >  9999 [ACK] Seq=103616 Ack=1 Win=65535 Len=1360 [TCP segment of a reassembled PDU]"
"145","0.154237759","10.0.0.1","10.1.0.2","TCP","1442","36011  >  9999 [ACK] Seq=104976 Ack=1 Win=65535 Len=1360 [TCP segment of a reassembled PDU]"
"146","0.154247778","10.0.0.1","10.1.0.2","TCP","1442","36011  >  9999 [ACK] Seq=106336 Ack=1 Win=65535 Len=1360 [TCP segment of a reassembled PDU]"
"147","0.154256826","10.0.0.1","10.1.0.2","TCP","1442","36011  >  9999 [ACK] Seq=107696 Ack=1 Win=65535 Len=1360 [TCP segment of a reassembled PDU]"
"148","0.154266524","10.0.0.1","10.1.0.2","TCP","1442","36011  >  9999 [ACK] Seq=109056 Ack=1 Win=65535 Len=1360 [TCP segment of a reassembled PDU]"
"149","0.154277706","10.0.0.1","10.1.0.2","TCP","1442","36011  >  9999 [ACK] Seq=110416 Ack=1 Win=65535 Len=1360 [TCP segment of a reassembled PDU]"
"150","0.154285060","10.0.0.1","10.1.0.2","TCP","1442","36011  >  9999 [ACK] Seq=111776 Ack=1 Win=65535 Len=1360 [TCP segment of a reassembled PDU]"
"151","0.154355523","10.1.0.2","10.0.0.1","TCP","82","[TCP Window Update] 9999  >  36011 [ACK] Seq=1 Ack=85936 Win=65535 Len=0"
"152","0.154368452","10.0.0.1","10.1.0.2","TCP","1442","36011  >  9999 [ACK] Seq=113136 Ack=1 Win=65535 Len=1360 [TCP segment of a reassembled PDU]"
"153","0.154390170","10.1.0.2","10.0.0.1","TCP","82","[TCP Dup ACK 131#1] 9999  >  36011 [ACK] Seq=1 Ack=85936 Win=65535 Len=0"
"154","0.154401235","10.0.0.1","10.1.0.2","TCP","1442","36011  >  9999 [ACK] Seq=114496 Ack=1 Win=65535 Len=1360 [TCP segment of a reassembled PDU]"
"155","0.154412367","10.0.0.1","10.1.0.2","TCP","1442","36011  >  9999 [ACK] Seq=115856 Ack=1 Win=65535 Len=1360 [TCP segment of a reassembled PDU]"
"156","0.154419340","10.0.0.1","10.1.0.2","TCP","1442","36011  >  9999 [ACK] Seq=117216 Ack=1 Win=65535 Len=1360 [TCP segment of a reassembled PDU]"
"157","0.154438273","10.1.0.2","10.0.0.1","TCP","82","[TCP Dup ACK 131#2] 9999  >  36011 [ACK] Seq=1 Ack=85936 Win=65535 Len=0"
"158","0.154438848","10.0.0.1","10.1.0.2","TCP","1442","36011  >  9999 [ACK] Seq=118576 Ack=1 Win=65535 Len=1360 [TCP segment of a reassembled PDU]"
"159","0.154447465","10.0.0.1","10.1.0.2","TCP","1442","36011  >  9999 [ACK] Seq=119936 Ack=1 Win=65535 Len=1360 [TCP segment of a reassembled PDU]"
"160","0.154454027","10.0.0.1","10.1.0.2","TCP","1442","36011  >  9999 [ACK] Seq=121296 Ack=1 Win=65535 Len=1360 [TCP segment of a reassembled PDU]"
"161","0.154460640","10.0.0.1","10.1.0.2","TCP","1442","36011  >  9999 [ACK] Seq=122656 Ack=1 Win=65535 Len=1360 [TCP segment of a reassembled PDU]"
"162","0.154469658","10.0.0.1","10.1.0.2","TCP","1442","36011  >  9999 [ACK] Seq=124016 Ack=1 Win=65535 Len=1360 [TCP segment of a reassembled PDU]"
"163","0.154479036","10.0.0.1","10.1.0.2","TCP","1442","36011  >  9999 [ACK] Seq=125376 Ack=1 Win=65535 Len=1360 [TCP segment of a reassembled PDU]"
"164","0.154507391","10.0.0.1","10.1.0.2","TCP","1442","36011  >  9999 [ACK] Seq=126736 Ack=1 Win=65535 Len=1360 [TCP segment of a reassembled PDU]"
"165","0.154575883","10.0.0.1","10.1.0.2","TCP","1442","36011  >  9999 [ACK] Seq=128096 Ack=1 Win=65535 Len=1360 [TCP segment of a reassembled PDU]"
"166","0.154596112","10.0.0.1","10.1.0.2","TCP","1442","36011  >  9999 [ACK] Seq=129456 Ack=1 Win=65535 Len=1360 [TCP segment of a reassembled PDU]"
"167","0.154623165","10.0.0.1","10.1.0.2","TCP","1442","36011  >  9999 [ACK] Seq=130816 Ack=1 Win=65535 Len=1360 [TCP segment of a reassembled PDU]"
"168","0.154639506","10.0.0.1","10.1.0.2","TCP","1442","36011  >  9999 [ACK] Seq=132176 Ack=1 Win=65535 Len=1360 [TCP segment of a reassembled PDU]"
"169","0.154657381","10.0.0.1","10.1.0.2","TCP","1442","36011  >  9999 [ACK] Seq=133536 Ack=1 Win=65535 Len=1360 [TCP segment of a reassembled PDU]"
"170","0.154663924","10.0.0.1","10.1.0.2","TCP","1442","36011  >  9999 [ACK] Seq=134896 Ack=1 Win=65535 Len=1360 [TCP segment of a reassembled PDU]"
"171","0.154670366","10.0.0.1","10.1.0.2","TCP","1442","36011  >  9999 [ACK] Seq=136256 Ack=1 Win=65535 Len=1360 [TCP segment of a reassembled PDU]"
"172","0.154678111","10.0.0.1","10.1.0.2","TCP","1442","36011  >  9999 [ACK] Seq=137616 Ack=1 Win=65535 Len=1360 [TCP segment of a reassembled PDU]"
"173","0.154687479","10.0.0.1","10.1.0.2","TCP","1442","36011  >  9999 [ACK] Seq=138976 Ack=1 Win=65535 Len=1360 [TCP segment of a reassembled PDU]"
"174","0.154710754","10.0.0.1","10.1.0.2","TCP","1442","36011  >  9999 [ACK] Seq=140336 Ack=1 Win=65535 Len=1360 [TCP segment of a reassembled PDU]"
"175","0.154719000","10.0.0.1","10.1.0.2","TCP","1442","36011  >  9999 [ACK] Seq=141696 Ack=1 Win=65535 Len=1360 [TCP segment of a reassembled PDU]"
"176","0.154725673","10.0.0.1","10.1.0.2","TCP","1442","36011  >  9999 [ACK] Seq=143056 Ack=1 Win=65535 Len=1360 [TCP segment of a reassembled PDU]"
"177","0.154733699","10.0.0.1","10.1.0.2","TCP","1442","36011  >  9999 [ACK] Seq=144416 Ack=1 Win=65535 Len=1360 [TCP segment of a reassembled PDU]"
"178","0.154758246","10.0.0.1","10.1.0.2","TCP","1442","36011  >  9999 [ACK] Seq=145776 Ack=1 Win=65535 Len=1360 [TCP segment of a reassembled PDU]"
"179","0.154769097","10.0.0.1","10.1.0.2","TCP","1442","36011  >  9999 [ACK] Seq=147136 Ack=1 Win=65535 Len=1360 [TCP segment of a reassembled PDU]"
"180","0.154799686","10.0.0.1","10.1.0.2","TCP","337","36011  >  9999 [ACK] Seq=148496 Ack=1 Win=65535 Len=255 [TCP segment of a reassembled PDU]"
"181","0.154835372","10.1.0.2","10.0.0.1","TCP","82","[TCP Dup ACK 131#3] 9999  >  36011 [ACK] Seq=1 Ack=85936 Win=65535 Len=0"
"182","0.154921078","10.1.0.2","10.0.0.1","TCP","82","[TCP Dup ACK 131#4] 9999  >  36011 [ACK] Seq=1 Ack=85936 Win=65535 Len=0"
"183","0.154941096","10.1.0.2","10.0.0.1","TCP","82","[TCP Dup ACK 131#5] 9999  >  36011 [ACK] Seq=1 Ack=85936 Win=65535 Len=0"
"184","0.154951647","10.1.0.2","10.0.0.1","TCP","82","[TCP Dup ACK 131#6] 9999  >  36011 [ACK] Seq=1 Ack=85936 Win=65535 Len=0"
"185","0.154957087","10.1.0.2","10.0.0.1","TCP","82","[TCP Dup ACK 131#7] 9999  >  36011 [ACK] Seq=1 Ack=85936 Win=65535 Len=0"
"186","0.154972056","10.1.0.2","10.0.0.1","TCP","82","[TCP Dup ACK 131#8] 9999  >  36011 [ACK] Seq=1 Ack=85936 Win=65535 Len=0"
"187","0.154981474","10.1.0.2","10.0.0.1","TCP","82","[TCP Dup ACK 131#9] 9999  >  36011 [ACK] Seq=1 Ack=85936 Win=65535 Len=0"
"188","0.154985973","10.1.0.2","10.0.0.1","TCP","82","[TCP Dup ACK 131#10] 9999  >  36011 [ACK] Seq=1 Ack=85936 Win=65535 Len=0"
"189","0.154990312","10.1.0.2","10.0.0.1","TCP","82","[TCP Dup ACK 131#11] 9999  >  36011 [ACK] Seq=1 Ack=85936 Win=65535 Len=0"
"190","0.155000581","10.1.0.2","10.0.0.1","TCP","82","[TCP Dup ACK 131#12] 9999  >  36011 [ACK] Seq=1 Ack=85936 Win=65535 Len=0"
"191","0.155025430","10.1.0.2","10.0.0.1","TCP","82","[TCP Dup ACK 131#13] 9999  >  36011 [ACK] Seq=1 Ack=85936 Win=65535 Len=0"
"192","0.155029978","10.1.0.2","10.0.0.1","TCP","82","[TCP Dup ACK 131#14] 9999  >  36011 [ACK] Seq=1 Ack=85936 Win=65535 Len=0"
"193","0.155034397","10.1.0.2","10.0.0.1","TCP","82","[TCP Dup ACK 131#15] 9999  >  36011 [ACK] Seq=1 Ack=85936 Win=65535 Len=0"
"194","0.155039226","10.1.0.2","10.0.0.1","TCP","82","[TCP Dup ACK 131#16] 9999  >  36011 [ACK] Seq=1 Ack=85936 Win=65535 Len=0"
"195","0.155045138","10.1.0.2","10.0.0.1","TCP","82","[TCP Dup ACK 131#17] 9999  >  36011 [ACK] Seq=1 Ack=85936 Win=65535 Len=0"
"196","0.155049937","10.1.0.2","10.0.0.1","TCP","82","[TCP Dup ACK 131#18] 9999  >  36011 [ACK] Seq=1 Ack=85936 Win=65535 Len=0"
"197","0.155056991","10.1.0.2","10.0.0.1","TCP","82","[TCP Dup ACK 131#19] 9999  >  36011 [ACK] Seq=1 Ack=85936 Win=65535 Len=0"
"198","0.155062802","10.1.0.2","10.0.0.1","TCP","82","[TCP Dup ACK 131#20] 9999  >  36011 [ACK] Seq=1 Ack=85936 Win=65535 Len=0"
"199","0.155071278","10.1.0.2","10.0.0.1","TCP","82","[TCP Dup ACK 131#21] 9999  >  36011 [ACK] Seq=1 Ack=85936 Win=65535 Len=0"
"200","0.155102118","10.1.0.2","10.0.0.1","TCP","82","[TCP Dup ACK 131#22] 9999  >  36011 [ACK] Seq=1 Ack=85936 Win=65535 Len=0"
"201","0.155124040","10.1.0.2","10.0.0.1","TCP","82","[TCP Dup ACK 131#23] 9999  >  36011 [ACK] Seq=1 Ack=85936 Win=65535 Len=0"
"202","0.155129822","10.1.0.2","10.0.0.1","TCP","82","[TCP Dup ACK 131#24] 9999  >  36011 [ACK] Seq=1 Ack=85936 Win=65535 Len=0"
"203","0.155134380","10.1.0.2","10.0.0.1","TCP","82","[TCP Dup ACK 131#25] 9999  >  36011 [ACK] Seq=1 Ack=85936 Win=65535 Len=0"
"204","0.155146053","10.1.0.2","10.0.0.1","TCP","82","[TCP Dup ACK 131#26] 9999  >  36011 [ACK] Seq=1 Ack=85936 Win=65535 Len=0"
"205","0.155151964","10.1.0.2","10.0.0.1","TCP","82","[TCP Dup ACK 131#27] 9999  >  36011 [ACK] Seq=1 Ack=85936 Win=65535 Len=0"
"206","0.155167575","10.1.0.2","10.0.0.1","TCP","82","[TCP Dup ACK 131#28] 9999  >  36011 [ACK] Seq=1 Ack=85936 Win=65535 Len=0"
"207","0.155188044","10.1.0.2","10.0.0.1","TCP","82","[TCP Dup ACK 131#29] 9999  >  36011 [ACK] Seq=1 Ack=85936 Win=65535 Len=0"
"208","0.155193525","10.1.0.2","10.0.0.1","TCP","82","[TCP Dup ACK 131#30] 9999  >  36011 [ACK] Seq=1 Ack=85936 Win=65535 Len=0"
"209","0.155198084","10.1.0.2","10.0.0.1","TCP","82","[TCP Dup ACK 131#31] 9999  >  36011 [ACK] Seq=1 Ack=85936 Win=65535 Len=0"
"210","0.155209406","10.1.0.2","10.0.0.1","TCP","82","[TCP Dup ACK 131#32] 9999  >  36011 [ACK] Seq=1 Ack=85936 Win=65535 Len=0"
"211","0.155214586","10.1.0.2","10.0.0.1","TCP","82","[TCP Dup ACK 131#33] 9999  >  36011 [ACK] Seq=1 Ack=85936 Win=65535 Len=0"
"212","0.155219635","10.1.0.2","10.0.0.1","TCP","82","[TCP Dup ACK 131#34] 9999  >  36011 [ACK] Seq=1 Ack=85936 Win=65535 Len=0"
"213","0.155231859","10.1.0.2","10.0.0.1","TCP","82","[TCP Dup ACK 131#35] 9999  >  36011 [ACK] Seq=1 Ack=85936 Win=65535 Len=0"
"214","0.155250645","10.1.0.2","10.0.0.1","TCP","82","[TCP Dup ACK 131#36] 9999  >  36011 [ACK] Seq=1 Ack=85936 Win=65535 Len=0"
"215","0.155256106","10.1.0.2","10.0.0.1","TCP","82","[TCP Dup ACK 131#37] 9999  >  36011 [ACK] Seq=1 Ack=85936 Win=65535 Len=0"
"216","0.155267568","10.1.0.2","10.0.0.1","TCP","82","[TCP Dup ACK 131#38] 9999  >  36011 [ACK] Seq=1 Ack=85936 Win=65535 Len=0"
"217","0.155272708","10.1.0.2","10.0.0.1","TCP","82","[TCP Dup ACK 131#39] 9999  >  36011 [ACK] Seq=1 Ack=85936 Win=65535 Len=0"
"218","0.155277487","10.1.0.2","10.0.0.1","TCP","82","[TCP Dup ACK 131#40] 9999  >  36011 [ACK] Seq=1 Ack=85936 Win=65535 Len=0"
"219","0.155282397","10.1.0.2","10.0.0.1","TCP","82","[TCP Dup ACK 131#41] 9999  >  36011 [ACK] Seq=1 Ack=85936 Win=65535 Len=0"
"220","0.155287036","10.1.0.2","10.0.0.1","TCP","82","[TCP Dup ACK 131#42] 9999  >  36011 [ACK] Seq=1 Ack=85936 Win=65535 Len=0"
"221","0.352705511","10.0.0.1","10.1.0.2","TCP","1442","[TCP Retransmission] 36011  >  9999 [ACK] Seq=85936 Ack=1 Win=65535 Len=1360"
"222","0.353377973","10.1.0.2","10.0.0.1","TCP","82","9999  >  36011 [ACK] Seq=1 Ack=136256 Win=15215 Len=0"
"223","0.353535769","10.0.0.1","10.1.0.2","TCP","1442","36011  >  9999 [ACK] Seq=148751 Ack=1 Win=65535 Len=1360 [TCP segment of a reassembled PDU]"
"224","0.353567721","10.0.0.1","10.1.0.2","TCP","1442","[TCP Window Full] 36011  >  9999 [ACK] Seq=150111 Ack=1 Win=65535 Len=1360 [TCP segment of a reassembled PDU]"
"225","0.353854044","10.1.0.2","10.0.0.1","TCP","82","[TCP Window Update] 9999  >  36011 [ACK] Seq=1 Ack=136256 Win=65535 Len=0"
"226","0.353887128","10.1.0.2","10.0.0.1","TCP","82","[TCP Dup ACK 222#1] 9999  >  36011 [ACK] Seq=1 Ack=136256 Win=65535 Len=0"
"227","0.753685401","10.0.0.1","10.1.0.2","TCP","1442","[TCP Retransmission] 36011  >  9999 [ACK] Seq=136256 Ack=1 Win=65535 Len=1360"
"228","0.754229193","10.1.0.2","10.0.0.1","TCP","82","9999  >  36011 [ACK] Seq=1 Ack=151471 Win=50320 Len=0"
"229","0.754378392","10.0.0.1","10.1.0.2","TCP","1442","36011  >  9999 [ACK] Seq=151471 Ack=1 Win=65535 Len=1360 [TCP segment of a reassembled PDU]"
"230","0.754402689","10.0.0.1","10.1.0.2","TCP","1442","36011  >  9999 [ACK] Seq=152831 Ack=1 Win=65535 Len=1360 [TCP segment of a reassembled PDU]"
"231","0.754408561","10.0.0.1","10.1.0.2","TCP","1442","36011  >  9999 [ACK] Seq=154191 Ack=1 Win=65535 Len=1360 [TCP segment of a reassembled PDU]"
"232","0.754413821","10.0.0.1","10.1.0.2","TCP","1442","36011  >  9999 [ACK] Seq=155551 Ack=1 Win=65535 Len=1360 [TCP segment of a reassembled PDU]"
"233","0.754418430","10.0.0.1","10.1.0.2","TCP","1442","36011  >  9999 [ACK] Seq=156911 Ack=1 Win=65535 Len=1360 [TCP segment of a reassembled PDU]"
"234","0.754422908","10.0.0.1","10.1.0.2","TCP","1442","36011  >  9999 [ACK] Seq=158271 Ack=1 Win=65535 Len=1360 [TCP segment of a reassembled PDU]"
"235","0.754427307","10.0.0.1","10.1.0.2","TCP","1442","36011  >  9999 [ACK] Seq=159631 Ack=1 Win=65535 Len=1360 [TCP segment of a reassembled PDU]"
"236","0.754495649","10.0.0.1","10.1.0.2","TCP","1442","36011  >  9999 [ACK] Seq=160991 Ack=1 Win=65535 Len=1360 [TCP segment of a reassembled PDU]"
"237","0.754509316","10.0.0.1","10.1.0.2","TCP","1442","36011  >  9999 [ACK] Seq=162351 Ack=1 Win=65535 Len=1360 [TCP segment of a reassembled PDU]"
"238","0.754517051","10.0.0.1","10.1.0.2","TCP","1442","36011  >  9999 [ACK] Seq=163711 Ack=1 Win=65535 Len=1360 [TCP segment of a reassembled PDU]"
"239","0.754523984","10.0.0.1","10.1.0.2","TCP","1442","36011  >  9999 [ACK] Seq=165071 Ack=1 Win=65535 Len=1360 [TCP segment of a reassembled PDU]"
"240","0.754531028","10.0.0.1","10.1.0.2","TCP","1442","36011  >  9999 [ACK] Seq=166431 Ack=1 Win=65535 Len=1360 [TCP segment of a reassembled PDU]"
"241","0.754537610","10.0.0.1","10.1.0.2","TCP","1442","36011  >  9999 [ACK] Seq=167791 Ack=1 Win=65535 Len=1360 [TCP segment of a reassembled PDU]"
"242","0.754544484","10.0.0.1","10.1.0.2","TCP","1442","36011  >  9999 [ACK] Seq=169151 Ack=1 Win=65535 Len=1360 [TCP segment of a reassembled PDU]"
"243","0.754641772","10.0.0.1","10.1.0.2","TCP","1442","36011  >  9999 [ACK] Seq=170511 Ack=1 Win=65535 Len=1360 [TCP segment of a reassembled PDU]"
"244","0.754653966","10.0.0.1","10.1.0.2","TCP","1442","36011  >  9999 [ACK] Seq=171871 Ack=1 Win=65535 Len=1360 [TCP segment of a reassembled PDU]"
"245","0.754659576","10.0.0.1","10.1.0.2","TCP","1442","36011  >  9999 [ACK] Seq=173231 Ack=1 Win=65535 Len=1360 [TCP segment of a reassembled PDU]"
"246","0.754666259","10.0.0.1","10.1.0.2","TCP","1442","36011  >  9999 [ACK] Seq=174591 Ack=1 Win=65535 Len=1360 [TCP segment of a reassembled PDU]"
"247","0.754673093","10.0.0.1","10.1.0.2","TCP","1442","36011  >  9999 [ACK] Seq=175951 Ack=1 Win=65535 Len=1360 [TCP segment of a reassembled PDU]"
"248","0.754680226","10.0.0.1","10.1.0.2","TCP","1442","36011  >  9999 [ACK] Seq=177311 Ack=1 Win=65535 Len=1360 [TCP segment of a reassembled PDU]"
"249","0.754686899","10.0.0.1","10.1.0.2","TCP","1442","36011  >  9999 [ACK] Seq=178671 Ack=1 Win=65535 Len=1360 [TCP segment of a reassembled PDU]"
"250","0.754693232","10.0.0.1","10.1.0.2","TCP","1442","36011  >  9999 [ACK] Seq=180031 Ack=1 Win=65535 Len=1360 [TCP segment of a reassembled PDU]"
"251","0.754700335","10.0.0.1","10.1.0.2","TCP","1442","36011  >  9999 [ACK] Seq=181391 Ack=1 Win=65535 Len=1360 [TCP segment of a reassembled PDU]"
"252","0.754706948","10.0.0.1","10.1.0.2","TCP","1442","36011  >  9999 [ACK] Seq=182751 Ack=1 Win=65535 Len=1360 [TCP segment of a reassembled PDU]"
"253","0.754727137","10.0.0.1","10.1.0.2","TCP","1442","36011  >  9999 [ACK] Seq=184111 Ack=1 Win=65535 Len=1360 [TCP segment of a reassembled PDU]"
"254","0.754736165","10.0.0.1","10.1.0.2","TCP","1442","36011  >  9999 [ACK] Seq=185471 Ack=1 Win=65535 Len=1360 [TCP segment of a reassembled PDU]"
"255","0.754745332","10.0.0.1","10.1.0.2","TCP","1442","36011  >  9999 [ACK] Seq=186831 Ack=1 Win=65535 Len=1360 [TCP segment of a reassembled PDU]"
"256","0.754752166","10.0.0.1","10.1.0.2","TCP","1442","36011  >  9999 [ACK] Seq=188191 Ack=1 Win=65535 Len=1360 [TCP segment of a reassembled PDU]"
"257","0.754757797","10.0.0.1","10.1.0.2","TCP","1442","36011  >  9999 [ACK] Seq=189551 Ack=1 Win=65535 Len=1360 [TCP segment of a reassembled PDU]"
"258","0.754767245","10.0.0.1","10.1.0.2","TCP","1442","36011  >  9999 [ACK] Seq=190911 Ack=1 Win=65535 Len=1360 [TCP segment of a reassembled PDU]"
"259","0.754774399","10.0.0.1","10.1.0.2","TCP","1442","36011  >  9999 [ACK] Seq=192271 Ack=1 Win=65535 Len=1360 [TCP segment of a reassembled PDU]"
"260","0.754804216","10.1.0.2","10.0.0.1","TCP","82","9999  >  36011 [ACK] Seq=1 Ack=152831 Win=64175 Len=0"
"261","0.754827391","10.1.0.2","10.0.0.1","TCP","82","9999  >  36011 [ACK] Seq=1 Ack=154191 Win=62815 Len=0"
"262","0.754830309","10.0.0.1","10.1.0.2","TCP","1442","36011  >  9999 [ACK] Seq=193631 Ack=1 Win=65535 Len=1360 [TCP segment of a reassembled PDU]"
"263","0.754836008","10.1.0.2","10.0.0.1","TCP","82","9999  >  36011 [ACK] Seq=1 Ack=155551 Win=61455 Len=0"
"264","0.754842811","10.1.0.2","10.0.0.1","TCP","82","9999  >  36011 [ACK] Seq=1 Ack=156911 Win=60095 Len=0"
"265","0.754842693","10.0.0.1","10.1.0.2","TCP","1442","36011  >  9999 [ACK] Seq=194991 Ack=1 Win=65535 Len=1360 [TCP segment of a reassembled PDU]"
"266","0.754850696","10.1.0.2","10.0.0.1","TCP","82","9999  >  36011 [ACK] Seq=1 Ack=158271 Win=58735 Len=0"
"267","0.754851760","10.0.0.1","10.1.0.2","TCP","1442","36011  >  9999 [ACK] Seq=196351 Ack=1 Win=65535 Len=1360 [TCP segment of a reassembled PDU]"
"268","0.754857981","10.1.0.2","10.0.0.1","TCP","82","9999  >  36011 [ACK] Seq=1 Ack=159631 Win=57375 Len=0"
"269","0.754859465","10.0.0.1","10.1.0.2","TCP","1442","36011  >  9999 [ACK] Seq=197711 Ack=1 Win=65535 Len=1360 [TCP segment of a reassembled PDU]"
"270","0.754865094","10.1.0.2","10.0.0.1","TCP","82","9999  >  36011 [ACK] Seq=1 Ack=160991 Win=56015 Len=0"
"271","0.754868502","10.0.0.1","10.1.0.2","TCP","1442","36011  >  9999 [ACK] Seq=199071 Ack=1 Win=65535 Len=1360 [TCP segment of a reassembled PDU]"
"272","0.754872699","10.1.0.2","10.0.0.1","TCP","82","9999  >  36011 [ACK] Seq=1 Ack=162351 Win=64175 Len=0"
"273","0.754876498","10.0.0.1","10.1.0.2","TCP","1442","36011  >  9999 [ACK] Seq=200431 Ack=1 Win=65535 Len=1360 [TCP segment of a reassembled PDU]"
"274","0.754884313","10.0.0.1","10.1.0.2","TCP","1442","36011  >  9999 [ACK] Seq=201791 Ack=1 Win=65535 Len=1360 [TCP segment of a reassembled PDU]"
"275","0.754891888","10.0.0.1","10.1.0.2","TCP","1442","36011  >  9999 [ACK] Seq=203151 Ack=1 Win=65535 Len=1360 [TCP segment of a reassembled PDU]"
"276","0.754951972","10.1.0.2","10.0.0.1","TCP","82","9999  >  36011 [ACK] Seq=1 Ack=163711 Win=62815 Len=0"
"277","0.754967693","10.0.0.1","10.1.0.2","TCP","1442","36011  >  9999 [ACK] Seq=204511 Ack=1 Win=65535 Len=1360 [TCP segment of a reassembled PDU]"
"278","0.754985638","10.1.0.2","10.0.0.1","TCP","82","9999  >  36011 [ACK] Seq=1 Ack=165071 Win=64175 Len=0"
"279","0.754992531","10.0.0.1","10.1.0.2","TCP","1442","36011  >  9999 [ACK] Seq=205871 Ack=1 Win=65535 Len=1360 [TCP segment of a reassembled PDU]"
"280","0.754999514","10.0.0.1","10.1.0.2","TCP","1442","36011  >  9999 [ACK] Seq=207231 Ack=1 Win=65535 Len=1360 [TCP segment of a reassembled PDU]"
"281","0.755007951","10.0.0.1","10.1.0.2","TCP","1442","36011  >  9999 [ACK] Seq=208591 Ack=1 Win=65535 Len=1360 [TCP segment of a reassembled PDU]"
"282","0.755013211","10.1.0.2","10.0.0.1","TCP","82","9999  >  36011 [ACK] Seq=1 Ack=167791 Win=61455 Len=0"
"283","0.755018431","10.0.0.1","10.1.0.2","TCP","1442","36011  >  9999 [ACK] Seq=209951 Ack=1 Win=65535 Len=1360 [TCP segment of a reassembled PDU]"
"284","0.755019463","10.1.0.2","10.0.0.1","TCP","82","9999  >  36011 [ACK] Seq=1 Ack=169151 Win=60095 Len=0"
"285","0.755024282","10.1.0.2","10.0.0.1","TCP","82","9999  >  36011 [ACK] Seq=1 Ack=170511 Win=58735 Len=0"
"286","0.755028150","10.0.0.1","10.1.0.2","TCP","1442","36011  >  9999 [ACK] Seq=211311 Ack=1 Win=65535 Len=1360 [TCP segment of a reassembled PDU]"
"287","0.755028951","10.1.0.2","10.0.0.1","TCP","82","9999  >  36011 [ACK] Seq=1 Ack=171871 Win=64175 Len=0"
"288","0.755033651","10.1.0.2","10.0.0.1","TCP","82","9999  >  36011 [ACK] Seq=1 Ack=173231 Win=62815 Len=0"
"289","0.755037167","10.0.0.1","10.1.0.2","TCP","1442","36011  >  9999 [ACK] Seq=212671 Ack=1 Win=65535 Len=1360 [TCP segment of a reassembled PDU]"
"290","0.755038530","10.1.0.2","10.0.0.1","TCP","82","9999  >  36011 [ACK] Seq=1 Ack=174591 Win=64175 Len=0"
"291","0.755045654","10.1.0.2","10.0.0.1","TCP","82","9999  >  36011 [ACK] Seq=1 Ack=175951 Win=62815 Len=0"
"292","0.755045613","10.0.0.1","10.1.0.2","TCP","1442","36011  >  9999 [ACK] Seq=214031 Ack=1 Win=65535 Len=1360 [TCP segment of a reassembled PDU]"
